,tweet,word_count,clean_tweet
1069,@qAzithen උඹ කියපු එකට මමත් අඩුවැඩිය එකතු කළේ. උබ කිව්වේ ඇත්ත. උඹ ඔය කියපු ඇත්ත මේකේ ලුම්පන් හැත්තට විහිළුවක් විතරයි. මොකද උන් අම්මා සහෝදරී නිදි කරවලා හරි සල්ලි එනවා නම් එච්චරයි මානසිකත්වයක ඉන්නේ.,33,උඹ කියපු එකට මමත් අඩුවැඩිය එකතු කළේ . උබ කිව්වේ ඇත්ත . උඹ ඔය කියපු ඇත්ත මේකේ ලුම්පන් හැත්තට විහිළුවක් විතරයි . මොකද උන් අම්මා සහෝදරී නිදි කරවලා හරි සල්ලි එනවා නම් එච්චරයි මානසිකත්වයක ඉන්නේ .
1070,"@lankacnews මේ මේසය වටේ ඉන්න හැම කාළකණ්ණියෙක්ටම ලෝකයේ තියෙන දරුණුම වෛරසය හැදිලා හැදිගෑවිලා යන්න ඕනේ. වායුසමීකරණ කාමරවල ඉන්න මේ හොර හැත්තට සහ උන්ගේ පවුල්වල උපන්, නූපන් හැමෝටම වැහි නැති හෙණගහන්න ඕනෙ.",31,"මේ මේසය වටේ ඉන්න හැම කාළකණ්ණියෙක්ටම ලෝකයේ තියෙන දරුණුම වෛරසය හැදිලා හැදිගෑවිලා යන්න ඕනේ . වායුසමීකරණ කාමරවල ඉන්න මේ හොර හැත්තට සහ උන්ගේ පවුල්වල උපන් , නූපන් හැමෝටම වැහි නැති හෙණගහන්න ඕනෙ ."
1071,"මහ ලොකුවට තලිබාන්ට බනිනව, හැබැයි උංගෙ කාසියක් ගන්න අපි දෙකයි පනහක් දෙන්නෝන... අපේ ගොබ්බ හැත්තට මේවා තේරෙන්නෙ කොහෙද 😏😏  @BizColombo @CharukaLive",22,"මහ ලොකුවට තලිබාන්ට බනිනව , හැබැයි උංගෙ කාසියක් ගන්න අපි දෙකයි පනහක් දෙන්නෝන . . . අපේ ගොබ්බ හැත්තට මේවා තේරෙන්නෙ කොහෙද"
1072,@varuna_vn 🌝 පකේ අර්තාපල් කමුත 😂💔,6,පකේ අර්තාපල් කමුත
1073,කාටද ඕන? පකේ අල පෙති 👇😊  https://t.co/IUkY8oRmOp,8,කාටද ඕන ? පකේ අල පෙති .
1074,පකේ අර්තාපල් chips. 😌,4,පකේ අර්තාපල් .
1075,@nipuna__d මහ පකේ ගානක්නෙ ඒක.500ට ඕක කන්න,7,මහ පකේ ගානක්නෙ ඒක . ට ඕක කන්න
1076,@nipuna__d @officialthimira උබේ පකේ චිප් ගොඩක් තැන්වල දැක්ක.,8,උබේ පකේ චිප් ගොඩක් තැන්වල දැක්ක .
1077,@realChamith @officialthimira මගේ   පකේ චිප්ස් එක 😂💔,9,මගේ පකේ චිප්ස් එක
1078,@maashi_piries වාඩිවෙලා ඉද්දි ත්‍රීවීලරේ කරේ පකේ කලාම දනිසෙං මොනා කරන්නද ?? 🤭🤭,12,වාඩිවෙලා ඉද්දි ත්‍රීවීලරේ කරේ පකේ කලාම දනිසෙං මොනා කරන්නද ? ?
1079,@KamilaWDias පකේ රැකවරණය 🙂,4,පකේ රැකවරණය
1080,@619Sniper619 ෂෝයි 😋 පකේ සෑර් 🌚,6,ෂෝයි පකේ සෑර්
1081,@hirunews ලංකාවේ පකේ නීතිය මිනී මරලා සල්ලි දීලා ගෙදර යන්න පුළුවන් හෙනම ගහපිය,13,ලංකාවේ පකේ නීතිය මිනී මරලා සල්ලි දීලා ගෙදර යන්න පුළුවන් හෙනම ගහපිය
1082,"ගොන් පකේ කතා නොකිය හිටපං මල්ලි. For your last tweet was neither a question or a statement....It was just random rubbish being blabbered hoping it will make sense, a statement!",30,"ගොන් පකේ කතා නොකිය හිටපං මල්ලි . . . . . ,"
1083,දැං සංචරනෙ සීම කරන්නෙ තෙල් මිල වැඩි කරල මොල හතේ පකේ ලොජික්,12,දැං සංචරනෙ සීම කරන්නෙ තෙල් මිල වැඩි කරල මොල හතේ පකේ ලොජික්
1084,ලංකාවෙ කැම්පස් වල ඉන්ජොන්ගෙ කාමරේ බල්බ් එක මාරු කරල දෙන්නත් මෙඩ්ඩෙක්ට කතා කරනවලු. ලෝකල් පකේ ඉන්ජො 🖕🏼,17,ලංකාවෙ කැම්පස් වල ඉන්ජොන්ගෙ කාමරේ බල්බ් එක මාරු කරල දෙන්නත් මෙඩ්ඩෙක්ට කතා කරනවලු . ලෝකල් පකේ ඉන්ජො
1085,@ItsmeSuppa @shanki_thewitch මුන් පොස්වෙන්න පකේ ලයින් දාද්දි එවා නොපෙනෙනඋන්ට වටේම ගැහිච්ච බල්බ් පේනවා,13,මුන් පොස්වෙන්න පකේ ලයින් දාද්දි එවා නොපෙනෙනඋන්ට වටේම ගැහිච්ච බල්බ් පේනවා
1086,@G1hanH පකේ තික්ස්කින්ක් තියෙන්නේ උන්ගේ 😂. පිටින් මෙහෙමයි ඇතුලෙන් වෙන විදිහක් 🥴,12,පකේ තික්ස්කින්ක් තියෙන්නේ උන්ගේ . පිටින් මෙහෙමයි ඇතුලෙන් වෙන විදිහක්
1087,"බුදුරජාණන් වහන්සේ ගේ උතුම් නිර්වචනය අනුගමනය කරන්න කියලා මූ කියනවා ""පකේ කොට්ඨාසයක්"" ලු 🥴",14,"බුදුරජාණන් වහන්සේ ගේ උතුම් නිර්වචනය අනුගමනය කරන්න කියලා මූ කියනවා "" පකේ කොට්ඨාසයක් "" ලු"
1088,යන පකේ කොට්ඨාසයක්. ඒම නිසා බුදුරජාණන් වහන්සේ ගේ උතුම් නිර්වචනය අනුගමනය කර විදවන්න යන ඔබේ ජීවිතය හරි මාර්ගයට ගන්න. ඉස්තුති. හුදෙක්ම තරුණ ළමයි වෙනුවෙන් ජිවතේ අත්දැකීම් නොමැති. දෙමව්පියන් ගේ බලාපොරොත්තු ඉෂ්ට කරපල්ලා.  හමුවෙමු 🙂,35,යන පකේ කොට්ඨාසයක් . ඒම නිසා බුදුරජාණන් වහන්සේ ගේ උතුම් නිර්වචනය අනුගමනය කර විදවන්න යන ඔබේ ජීවිතය හරි මාර්ගයට ගන්න . ඉස්තුති . හුදෙක්ම තරුණ ළමයි වෙනුවෙන් ජිවතේ අත්දැකීම් නොමැති . දෙමව්පියන් ගේ බලාපොරොත්තු ඉෂ්ට කරපල්ලා . හමුවෙමු
1089,"The final understanding of this is simple. ""You obey our rules when you are a minority in our country. You also have to adjust your rules when we are in your country because we are minority"" පකේ ලොජික්නේ 😂. Who is the victim now පොඩ්ඩක් තේරුම් කරලා දෙන්නකො මෙයාලා.පොඩ්ඩක් confuse",50,". "" . "" පකේ ලොජික්නේ . පොඩ්ඩක් තේරුම් කරලා දෙන්නකො මෙයාලා . පොඩ්ඩක්"
1090,@GodahewaNalaka අනේ පලයං පරයා උබලගෙ පකේ ආණ්ඩුව,7,අනේ පලයං පරයා උබලගෙ පකේ ආණ්ඩුව
1091,රජයේ වැරදි විවේචනය කරන උන් ගහන බොරු මඩ වලට උත්තර දෙන හැමෝම ජෙප්පෝ විදියට දකිනවානම් නම් තොට රිදිලා ගොන් බයියෝ.😂,20,රජයේ වැරදි විවේචනය කරන උන් ගහන බොරු මඩ වලට උත්තර දෙන හැමෝම ජෙප්පෝ විදියට දකිනවානම් නම් තොට රිදිලා ගොන් බයියෝ .
1092,@suhani_arunika පෑලියාව නේත තොට..😏😂,4,පෑලියාව නේත තොට . .
1093,@InduInduu අනේ තොට එක ලව් එකක්වත් හරියන්න එපා කියපු කවුරුත් නෑ..,11,අනේ තොට එක ලව් එකක්වත් හරියන්න එපා කියපු කවුරුත් නෑ . .
1094,@sriavtvnetwork යකෝ උ අඩියක් ගැහුවම මොකද වෙන්නෙ? තොට අමාරැ ද?,10,යකෝ උ අඩියක් ගැහුවම මොකද වෙන්නෙ ? තොට අමාරැ ද ?
1095,හිත - බලපන් ඔන්ලයින්වත් ඇවිල්ලද කියලා😍  මොලය - තොට මෝල් කලන්තෙද උට්ටෝ 💔  #මරුහැබැයි,16,හිත - බලපන් ඔන්ලයින්වත් ඇවිල්ලද කියලාමොලය - තොට මෝල් කලන්තෙද උට්ටෝ මරුහැබැයි
1096,@aphrodite_Leo තොට නැති උනාට මට තියෙනවා...😏🐒,6,තොට නැති උනාට මට තියෙනවා . . .
1097,@chamithwije @sajithpremadasa @sjbsrilanka ගූ නෑවා නේද අනුන්ගෙ පුකේ අැගිලි ගහන් ගිහින්. ලැජ්ජා නැහැ තොට පෙන්නයා!!!😁😂,15,ගූ නෑවා නේද අනුන්ගෙ පුකේ අැගිලි ගහන් ගිහින් . ලැජ්ජා නැහැ තොට පෙන්නයා
1098,@HeartOfMonkeys තොට මොකටද ඒක  .උබ වාහන වල යන්නෙ නෑනේ .😏,11,තොට මොකටද ඒක . උබ වාහන වල යන්නෙ නෑනේ .
1099,@koshala123savin මග තොට විස්තර දාහල්ලා . එතකොට ලේසි,8,මග තොට විස්තර දාහල්ලා . එතකොට ලේසි
1100,"@chamithwije @RajapaksaNamal @sajithpremadasa ගොන් පොන්නයෝ...I didnt tag you. I quoted your stupid tweet and messaged Namal. I dont think anyone would wanna tweet a proven hypocrite, a liar like you.  මෝඩ මීහරකො...තොට එ්කවත් තේරැන්ගන්න මොළයක් නැද්ද ගොන් මූසලයො??  තෝ මගෙ පස්සෙන් අාවා කියලා මං මොනවා කරන්නද ගොනෝ??",49,"ගොන් පොන්නයෝ . . . . . , . මෝඩ මීහරකො . . . තොට එ්කවත් තේරැන්ගන්න මොළයක් නැද්ද ගොන් මූසලයො ? ? තෝ මගෙ පස්සෙන් අාවා කියලා මං මොනවා කරන්නද ගොනෝ ? ?"
1101,@ravinhwg තොට මම,3,තොට මම
1102,"@chamithwije @RajapaksaNamal Again, missed the point by a country mile. No wonder being the රට මීහරකා you are. You think ppl are jobless like you කාලකන්නි to go sniffing around other people's asses without doing anything productive?  Get ur own house in order!  තොට මීහරකා කියන එක, මීහරක්ට කරන නව නිංගිරාවක්!",53,", . රට මීහරකා . කාලකන්නි ' ? තොට මීහරකා කියන එක , මීහරක්ට කරන නව නිංගිරාවක්"
1103,"@chamithwije @RajapaksaNamal SLPP is not the courts u fool &amp; besides its not about what the party or the cops do or did - Its about what නිවට පොන්නයෝ like you did or said.  තෝ එක වචනයක් කිව්වද බොල වහල් බත්බෙළයො??  දැන්වත් තොට තේරෙනවද බූරැවෝ??  අනුන්ගෙ පුකේ අැගිලි ගහන්න ඉස්සෙල්ලා, තොගෙ හෙලුව වහගනින් මීහරකා!",57,"; - නිවට පොන්නයෝ . තෝ එක වචනයක් කිව්වද බොල වහල් බත්බෙළයො ? ? දැන්වත් තොට තේරෙනවද බූරැවෝ ? ? අනුන්ගෙ පුකේ අැගිලි ගහන්න ඉස්සෙල්ලා , තොගෙ හෙලුව වහගනින් මීහරකා"
1104,@__Banz මේවත් කන්න බැරිනම් තොට ගහන්න ඕනි 😂,8,මේවත් කන්න බැරිනම් තොට ගහන්න ඕනි
1105,@ShanakiyanR අහ්හ් බන් තොට ඕන ජාතිවාදෙ අවුස්සන්න නේද ???,9,අහ්හ් බන් තොට ඕන ජාතිවාදෙ අවුස්සන්න නේද ? ? ?
1106,@Us3rChang3d තොට ඒක නෑ වගේ 😬,6,තොට ඒක නෑ වගේ
1107,@gayanwinz @an_cabraal @IMFNews @CBSL බුරුවට හෙළකුරු ඇප් එක දාන හැටිවත් කියලා දෙන්න ද? උඹ වගේ ගොනෙක් හොඳයි රනිල්ටම. තොට වගේ අගහිඟයක් නැ ඕයි අනික් අයට.,25,බුරුවට හෙළකුරු ඇප් එක දාන හැටිවත් කියලා දෙන්න ද ? උඹ වගේ ගොනෙක් හොඳයි රනිල්ටම . තොට වගේ අගහිඟයක් නැ ඕයි අනික් අයට .
1108,පිංකෙත හෙල Run දෙරණින් තොට lept වෙන්නට  හේතු වාසනා වේවා හේතු වාසනා! 🌝🇱🇰🙏🏽,14,පිංකෙත හෙලදෙරණින් තොටවෙන්නටහේතු වාසනා වේවා හේතු වාසනා
1109,නන්නාඳුනන ලෙසේ  මග තොට යළිත් හමු වෙලා  මහ මෙර හිසින් දරාගෙන  අපි යමු දුරස් වෙලා 🖤,19,නන්නාඳුනන ලෙසේමග තොට යළිත් හමු වෙලාමහ මෙර හිසින් දරාගෙනඅපි යමු දුරස් වෙලා
1110,@harith1217 යසයි  තොට 😏,5,යසයිතොට
1111,@aphrodite_Leo හොදම වැඩේ තොට...😌🐒,4,හොදම වැඩේ තොට . . .
1112,@ushan93ukkun තොට මොකද වෙලා තියෙන්නෙ...,5,තොට මොකද වෙලා තියෙන්නෙ . . .
1113,"@UPGammanpila තොට යන්න අපායක් නෑ, even ruined alma mater. Remember, “County b 4 Self” ? #Traitor #Shameonyou 🤛  https://t.co/37Bqyc239Z",20,"තොට යන්න අපායක් නෑ , . , “ ” ? ."
1114,@SHAN__88 තොට මැරෙන්න උන කීවා නේද 🤣🤣🤣,7,තොට මැරෙන්න උන කීවා නේද
1115,@iam_AStr තොට කොරොනා,3,තොට කොරොනා
1116,හොරාකාපු නිසයි තොට එහෙම වෙන්නෙ  https://t.co/EKItJPVUCK,7,හොරාකාපු නිසයි තොට එහෙම වෙන්නෙ .
1117,@NethmiBotheju @unknown_lankan තොට හරියටම කියලා 😂💔,6,තොට හරියටම කියලා
1118,@iam_Nisansala @djharristattaya තොට ඉරිසියාව😂,4,තොට ඉරිසියාව
1119,@HeartOfMonkeys තොට කපපුවම තෙරෙයි,4,තොට කපපුවම තෙරෙයි
1120,@ItsmeSuppa ඉතින් තොට පැලියාවත?,4,ඉතින් තොට පැලියාවත ?
1121,@djharristattaya තොට බඩ යන්ඩොනෙ,4,තොට බඩ යන්ඩොනෙ
1122,@srijudge1 ඉන්දික තොට වත්ත ගේ පවුලේ කෙනෙක්,7,ඉන්දික තොට වත්ත ගේ පවුලේ කෙනෙක්
1123,📻 :- නන්නාඳුනන ලෙසේ මග තොට යලිත් හමු වෙලා... මහමෙර හිසින් දරාගෙන  අපි යමු දුරස් වෙලා...  👨 :- 😔😔😔😔,21,- නන්නාඳුනන ලෙසේ මග තොට යලිත් හමු වෙලා . . . මහමෙර හිසින් දරාගෙනඅපි යමු දුරස් වෙලා . . . -
1124,@srijudge1 ඇයි තොට අවුල්ද පරයා?,5,ඇයි තොට අවුල්ද පරයා ?
1125,@ItsmeSuppa කාලකන්නියෝ මේ මගේ ටී ල්  එක. මගේ එකේ ඕන එකක් දාන්න මට අයිතියක් තියෙනවා. තොට මොකද මගේ එකේ මොකක් කරත්.,22,කාලකන්නියෝ මේ මගේ ටී ල්එක . මගේ එකේ ඕන එකක් දාන්න මට අයිතියක් තියෙනවා . තොට මොකද මගේ එකේ මොකක් කරත් .
1126,@gim_Rathnayaka_ යස තොට..😂 ඉක්මනට එන්න ගිමා🖤,6,යස තොට . . ඉක්මනට එන්න ගිමා
1127,"@perumalpichaii This is why we don't prosper as a country, පඩ ෂෝ gets highest recognition.",15,"' , පඩ ෂෝ ."
1128,@BuduMalli කලිසම් දාලත් පඩ ගඳ එනවනේ,6,කලිසම් දාලත් පඩ ගඳ එනවනේ
1129,@SHAN__88 පඩ අරිනකොටත් ගදයි 🤭,5,පඩ අරිනකොටත් ගදයි
1130,@dilbolz කයියයි පඩ ගදයි  හිනාවයි විතරයි 😅,8,කයියයි පඩ ගදයිහිනාවයි විතරයි
1131,කයියයි පඩ ගදයි විතරයි 🤣🤣🤣,5,කයියයි පඩ ගදයි විතරයි
1132,@ItsmeSuppa @udara_grero නොදකින් ගොනා,4,නොදකින් ගොනා
1133,@LunaBerryx @faleelmhm @GotabayaR @RajapaksaNamal @PresRajapaksa නොදකින් කාලකන්නි. රටේ මිනිස්සුන්ගෙ දුක කියනකොට ඒ මන්ත්‍රිවරයට හිනාවෙන්නෙ පාර්ලිමේන්තුව පිස්සන්කොටුවක් කරගෙන රටම විනාස කරන කාලකන්නි,21,නොදකින් කාලකන්නි . රටේ මිනිස්සුන්ගෙ දුක කියනකොට ඒ මන්ත්‍රිවරයට හිනාවෙන්නෙ පාර්ලිමේන්තුව පිස්සන්කොටුවක් කරගෙන රටම විනාස කරන කාලකන්නි
1134,@KaviSenu මූ නම් සිරාවට ම අමු පිස්සෙක්. මුන්ගේ බැරි කමට තව ඉස්සරහට කියයි රටේ මිනිස්සු කනවා වැඩියි. අඩුවෙන් කෑවොත් රට හදන කජ්ජක් නෙවෙයි කියලා. තුහ් නොදකින් ගොං නාම්බා.,28,මූ නම් සිරාවට ම අමු පිස්සෙක් . මුන්ගේ බැරි කමට තව ඉස්සරහට කියයි රටේ මිනිස්සු කනවා වැඩියි . අඩුවෙන් කෑවොත් රට හදන කජ්ජක් නෙවෙයි කියලා . තුහ් නොදකින් ගොං නාම්බා .
1135,@srijudge1 අනේ නොදකින් තොපෙ දැක්ම?,5,අනේ නොදකින් තොපෙ දැක්ම ?
1136,@djharristattaya නොදකින් කොලුකාරයා.. උටමයි හරියන්නෙ..,5,නොදකින් කොලුකාරයා . . උටමයි හරියන්නෙ . .
1137,@ItsmeSuppa @Rajitha02327722 නොදකින් තෝ ☹️☹️🤦‍♂️🤦‍♂️,5,නොදකින් තෝ ‍‍
1138,@KamilaWDias @ShermiRaja නොදකින් 3% වස්තියෝ. මුන් කවදාවත් මේ රට හදන්න දෙන්නේ නෑ.,12,නොදකින් % වස්තියෝ . මුන් කවදාවත් මේ රට හදන්න දෙන්නේ නෑ .
1139,"අක්කි නෑ...😥 මල ලෙප්ට්😡..ඇයි බන් අක්කිට කරදර, දියන්කෝ ඕවා මට...😠😡😠 නොදකින් මේ දෙයියා😒... බූරු යකෙක්.. තූ... 😒😠😡  ඇක්කියෝ හොදවෙලා ඉක්මනටම එන්න.. නැත්තම් මල්ලිට පිස්සු තදවෙයි...🙏🙏🙏❤️",26,"අක්කි නෑ . . . මල ලෙප්ට් . . ඇයි බන් අක්කිට කරදර , දියන්කෝ ඕවා මට . . . නොදකින් මේ දෙයියා . . . බූරු යකෙක් . . තූ . . . ඇක්කියෝ හොදවෙලා ඉක්මනටම එන්න . . නැත්තම් මල්ලිට පිස්සු තදවෙයි . . ."
1140,@unknown_lankan නොදකින් kamri ගෙම්බා,4,නොදකින්ගෙම්බා
1141,"මේන්න මේ වගේ දේ දොඩෝන වාහෙලටයී තමයී, අපේ ගැමියෝ කීවේ ""මූට අමු කැවිලද කොහෙද කියලා"". තූ නොදකින්, මෙහෙමත් මාධ්‍යවාදියෝ. මුන්ට අකුරු උගන්නපු ගුරුවන්ටත් ලැජ්ජාවක්.    https://t.co/tBbbfpMbIm",28,"මේන්න මේ වගේ දේ දොඩෝන වාහෙලටයී තමයී , අපේ ගැමියෝ කීවේ "" මූට අමු කැවිලද කොහෙද කියලා "" . තූ නොදකින් , මෙහෙමත් මාධ්‍යවාදියෝ . මුන්ට අකුරු උගන්නපු ගුරුවන්ටත් ලැජ්ජාවක් . ."
1142,නොදකින් දෙඹරා 😂😂😂,3,නොදකින් දෙඹරා
1143,නොදකින් මේ මහ රෑ මට පේන ටුවිට්,7,නොදකින් මේ මහ රෑ මට පේන ටුවිට්
1144,@ItsDonPeter අපි ඉතින් අනුන්ට දෙහි කපන්න හපන්නු නේ... වද කොත්තු එහෙම මතකද? 🤑🤑🤑 අර මිදි නරියා වගේ. නොදකින් විතරක්.....,19,අපි ඉතින් අනුන්ට දෙහි කපන්න හපන්නු නේ . . . වද කොත්තු එහෙම මතකද ? අර මිදි නරියා වගේ . නොදකින් විතරක් . . . . .
1145,@PissuPuusaa ඔව් බං නොදකින් කාලකන්නි රිලවා 🐒🔫😡,7,ඔව් බං නොදකින් කාලකන්නි රිලවා
